{
  "$schema": "urn:mcgen:schema:phase5-execution:1",
  "artifact": {
    "expectation": {
      "entrypointClasses": [
        "org.example.tuple.TupleProbe"
      ],
      "expectedExtension": ".jar",
      "iconPaths": [],
      "maxEntries": 2048,
      "metadataFields": {
        "entrypoints.main[0]": "org.example.tuple.TupleProbe",
        "id": "tuple-probe",
        "name": "Tuple Probe",
        "version": "1.0.0"
      },
      "metadataPaths": [
        "fabric.mod.json"
      ],
      "patterns": [
        "build/libs/tuple-probe-1.0.0.jar"
      ],
      "projectIdentity": {
        "id": "tuple-probe",
        "name": "Tuple Probe",
        "version": "1.0.0"
      },
      "requiredEntries": [
        "fabric.mod.json",
        "org/example/tuple/TupleProbe.class"
      ],
      "resourceNamespaces": []
    },
    "path": "build/libs/tuple-probe-1.0.0.jar"
  },
  "build": {
    "commands": [
      {
        "args": [
          "build"
        ],
        "executable": "./gradlew",
        "purpose": "build"
      },
      {
        "args": [
          "test"
        ],
        "executable": "./gradlew",
        "purpose": "unit-tests"
      }
    ],
    "java": {
      "distribution": "temurin",
      "runtime": 17
    },
    "limits": {
      "artifactRetentionDays": 30,
      "maxDiskBytes": 4294967296,
      "maxOutputBytes": 67108864,
      "retries": 1,
      "timeoutMs": 900000
    },
    "rawOverridePolicy": "never-execute",
    "workDirectoryPolicy": "isolated-clean",
    "wrapper": {
      "distributionSha256": "a4b4158601f8636cdeeab09bd76afb640030bb5b144aafe261a5e8af027dc612",
      "distributionUrl": "https://services.gradle.org/distributions/gradle-8.8-bin.zip",
      "kind": "launcher-script",
      "sha256": "0a95e5cb38e474b14dfe4499674ea8f6ce52157ca890bd4f1efbbe3c59eaafd9",
      "version": "8.8"
    }
  },
  "fixture": {
    "descriptorPath": "templates/fabric/descriptor.json",
    "fixture": {
      "buildSystem": "gradle",
      "gradleDsl": "kotlin",
      "id": "fabric.fabric.minimal-kotlin.kotlin.gradle.kotlin",
      "kind": "minimal-kotlin",
      "language": "kotlin",
      "rawOverride": false,
      "version": "1.0.0"
    },
    "spec": {
      "$schema": "urn:mcgen:schema:project-spec:3",
      "assets": [],
      "build": {
        "gradleDsl": "kotlin",
        "javaLanguage": 17,
        "system": "gradle"
      },
      "dependencies": [],
      "extensions": {},
      "features": [],
      "fileOperations": [],
      "metadata": {},
      "mode": "simple",
      "platform": {
        "apiVersion": "1.21",
        "catalogKey": "1.20.1",
        "components": {
          "fabricApi": "0.92.2+1.20.1",
          "loader": "0.15.11",
          "minecraft": "1.20.1",
          "yarn": "1.20.1+build.10"
        },
        "id": "fabric",
        "java": 17,
        "javaLanguage": 17
      },
      "project": {
        "authors": [
          "EnVy"
        ],
        "description": "tuple probe",
        "id": "tuple-probe",
        "license": "MIT",
        "mainClass": "TupleProbe",
        "name": "Tuple Probe",
        "package": "org.example.tuple",
        "version": "1.0.0"
      },
      "publishing": {},
      "repositories": [],
      "repository": {},
      "schemaVersion": 3,
      "sourceLayout": {},
      "targetOverrides": [],
      "template": {
        "id": "fabric",
        "sourceLanguage": "kotlin"
      }
    },
    "tuple": {
      "buildSystem": "gradle",
      "catalogKey": "1.20.1",
      "catalogSnapshotId": "2026-08-11-r1",
      "components": {
        "fabricApi": "0.92.2+1.20.1",
        "loader": "0.15.11",
        "minecraft": "1.20.1",
        "yarn": "1.20.1+build.10"
      },
      "contentDigests": {
        "catalog": "63443809afdda3a84591d2486a3eab35873f8404d14d44c42bdd13cb84d75ff4",
        "descriptor": "24d3a3bf0f71e51f36b399c499439b17d07696a629e3bcc4a68d73055b726533",
        "fixture": "d438faec702a6c25dad4588de54f0c6eb2b66b68e297f55553662cd0908fe40b",
        "profile": "cb14a2eb6d172a0a6d7eebe765dd734a3ca1cc25fac7fe0c8e2a1abe55ab12a5",
        "template": "98e5c5f9757b7f4c0b2c7b4763ae4d063f5a6f0145f2733225a2b79a5c3b541d"
      },
      "descriptorId": "fabric",
      "descriptorRevision": 4,
      "family": "fabric",
      "fixtureId": "fabric.fabric.minimal-kotlin.kotlin.gradle.kotlin",
      "gradleDsl": "kotlin",
      "java": {
        "distribution": "temurin",
        "runtime": 17
      },
      "mappingDigest": "140bedbf9c3f6d56a9846d2ba7088798683f4da0c248231336e6a05679e4fdfe",
      "procedureDigest": "990deeeeb229079fcd49c6454108d09175a4a04ca9dce2af67ae1937d26edbb9",
      "profileId": "fabric",
      "profileRevision": 6,
      "sourceDigests": [
        "c4cb16a5eb6ad84c6610c9fb929edeb5ed288572265bab586e93e94076f3914e"
      ],
      "sourceLanguage": "kotlin",
      "wrapper": {
        "distributionSha256": "a4b4158601f8636cdeeab09bd76afb640030bb5b144aafe261a5e8af027dc612",
        "distributionUrl": "https://services.gradle.org/distributions/gradle-8.8-bin.zip",
        "kind": "launcher-script",
        "sha256": "0a95e5cb38e474b14dfe4499674ea8f6ce52157ca890bd4f1efbbe3c59eaafd9",
        "version": "8.8"
      }
    }
  },
  "generatedAt": "2026-08-10T00:00:00.000Z",
  "generatorDigest": "8879f8877c750a514805276ca7bae91eb25e58766b2f64c5b8824de691c1d555",
  "profilePath": "profiles/fabric.json",
  "tuple": {
    "blockers": [],
    "id": "69758924e965d18a8d346e8f467fa8e2f0269f5ea05c498a9f26bd281bb563e6",
    "identity": {
      "buildSystem": "gradle",
      "catalogKey": "1.20.1",
      "catalogSnapshotId": "2026-08-11-r1",
      "components": {
        "fabricApi": "0.92.2+1.20.1",
        "loader": "0.15.11",
        "minecraft": "1.20.1",
        "yarn": "1.20.1+build.10"
      },
      "contentDigests": {
        "catalog": "63443809afdda3a84591d2486a3eab35873f8404d14d44c42bdd13cb84d75ff4",
        "descriptor": "24d3a3bf0f71e51f36b399c499439b17d07696a629e3bcc4a68d73055b726533",
        "fixture": "d438faec702a6c25dad4588de54f0c6eb2b66b68e297f55553662cd0908fe40b",
        "profile": "cb14a2eb6d172a0a6d7eebe765dd734a3ca1cc25fac7fe0c8e2a1abe55ab12a5",
        "template": "98e5c5f9757b7f4c0b2c7b4763ae4d063f5a6f0145f2733225a2b79a5c3b541d"
      },
      "descriptorId": "fabric",
      "descriptorRevision": 4,
      "family": "fabric",
      "fixtureId": "fabric.fabric.minimal-kotlin.kotlin.gradle.kotlin",
      "gradleDsl": "kotlin",
      "java": {
        "distribution": "temurin",
        "runtime": 17
      },
      "mappingDigest": "140bedbf9c3f6d56a9846d2ba7088798683f4da0c248231336e6a05679e4fdfe",
      "procedureDigest": "990deeeeb229079fcd49c6454108d09175a4a04ca9dce2af67ae1937d26edbb9",
      "profileId": "fabric",
      "profileRevision": 6,
      "sourceDigests": [
        "c4cb16a5eb6ad84c6610c9fb929edeb5ed288572265bab586e93e94076f3914e"
      ],
      "sourceLanguage": "kotlin",
      "wrapper": {
        "distributionSha256": "a4b4158601f8636cdeeab09bd76afb640030bb5b144aafe261a5e8af027dc612",
        "distributionUrl": "https://services.gradle.org/distributions/gradle-8.8-bin.zip",
        "kind": "launcher-script",
        "sha256": "0a95e5cb38e474b14dfe4499674ea8f6ce52157ca890bd4f1efbbe3c59eaafd9",
        "version": "8.8"
      }
    },
    "status": "discovered"
  },
  "wrapperPath": "gradlew",
  "wrapperSource": "templates/spigot/gradlew-modern.tmpl"
}
